{"artifacts":[{"kind":"python-sdist","media_type":"application/gzip","name":"openadapt_flow-1.34.0.tar.gz","publish_destinations":["github-release","pypi"],"sha256":"sha256:a941a70015fe91897e655bfc9bf83e6cf8fbcf8bd4e4c7206ffb133c505203f8","size_bytes":20440838},{"kind":"python-wheel","media_type":"application/zip","name":"openadapt_flow-1.34.0-py3-none-any.whl","publish_destinations":["github-release","pypi"],"sha256":"sha256:56d32818989cb3a92830080ead39e10b08718c55e00988117f22cbfeaac98854","size_bytes":1928194}],"claim_scope":"production_flow","schema_version":"openadapt.production-release-artifact-inventory/v1","target":"flow"}
