{"artifacts":[{"kind":"python-sdist","media_type":"application/gzip","name":"openadapt_capture-1.2.2.tar.gz","publish_destinations":["github-release","pypi"],"sha256":"sha256:6f4298d3daadf9cced8994207e34b3116a79209ef792e98f778a0770e2f3406c","size_bytes":974499},{"kind":"python-wheel","media_type":"application/zip","name":"openadapt_capture-1.2.2-py3-none-any.whl","publish_destinations":["github-release","pypi"],"sha256":"sha256:550fffe50990fa8431d332bdd5fe4755976d83baa7ad62553f50ad9e4ddcd1ae","size_bytes":202545}],"claim_scope":"production_capture","schema_version":"openadapt.production-release-artifact-inventory/v1","target":"capture"}
