{"artifacts":[{"kind":"deployment-manifest","media_type":"application/vnd.openadapt.production-deployment-manifest+json;version=1","name":"openadapt-docs-e323249e3a7c1af9d7651312e0afe1f12c38c977.deployment-manifest.json","publish_destinations":["deployment"],"sha256":"sha256:be6da3476e1149d5101056a1ecab2f32db129fe876ff4b3703a9fcddde77569d","size_bytes":468}],"claim_scope":"production_docs","schema_version":"openadapt.production-release-artifact-inventory/v1","target":"docs"}
