{"artifacts":[{"kind":"deployment-manifest","media_type":"application/vnd.openadapt.production-deployment-manifest+json;version=1","name":"openadapt-cloud-e2db34a82f8c52e69b1b51e8c60ba45299491f53.deployment-manifest.json","publish_destinations":["deployment"],"sha256":"sha256:7bbbfd80b268b3b0569f5d3d253169bf84ca3c7d6880e65bc96466627feadab4","size_bytes":556}],"claim_scope":"production_cloud","schema_version":"openadapt.production-release-artifact-inventory/v1","target":"cloud"}
