{"artifacts":[{"kind":"python-sdist","media_type":"application/gzip","name":"openadapt_agent-2.0.1.tar.gz","publish_destinations":["github-release","pypi"],"sha256":"sha256:67e05b299a4f035a0482b3032decc151fafc22de9a12bb3d8f884f37ea4cc937","size_bytes":61814},{"kind":"python-wheel","media_type":"application/zip","name":"openadapt_agent-2.0.1-py3-none-any.whl","publish_destinations":["github-release","pypi"],"sha256":"sha256:5c5f6e3eca4c127d87b3affb8944223c0836916e0df57d0c6b8ba737b3bc8b5a","size_bytes":34183}],"claim_scope":"production_agent","schema_version":"openadapt.production-release-artifact-inventory/v1","target":"agent"}
