{"artifacts":[{"kind":"python-sdist","media_type":"application/gzip","name":"openadapt-1.16.0.tar.gz","publish_destinations":["github-release","pypi"],"sha256":"sha256:39d01612417dff5981b536b324a63498df1ea6f0128c723276609ebbe18d9a18","size_bytes":47028},{"kind":"python-wheel","media_type":"application/zip","name":"openadapt-1.16.0-py3-none-any.whl","publish_destinations":["github-release","pypi"],"sha256":"sha256:371693e7607d1cdc1ea360ef5d657c1af791a0af39677fa2ce5933e7ba712719","size_bytes":22539}],"claim_scope":"production_openadapt","schema_version":"openadapt.production-release-artifact-inventory/v1","target":"openadapt"}
