{"artifacts":[{"kind":"python-sdist","media_type":"application/gzip","name":"openadapt_desktop-0.16.0.tar.gz","publish_destinations":["github-release","pypi"],"sha256":"sha256:15f0c59a4d481328da76f3e5aa6a29ab8cdced8ab183c97346d69b4c14c996ff","size_bytes":1461442},{"kind":"python-wheel","media_type":"application/zip","name":"openadapt_desktop-0.16.0-py3-none-any.whl","publish_destinations":["github-release","pypi"],"sha256":"sha256:06e608a934deef56c93ee1ca8de511d6daba08459626e8245bd0db4c391e64e9","size_bytes":293557}],"claim_scope":"production_desktop","schema_version":"openadapt.production-release-artifact-inventory/v1","target":"desktop"}
